<?xml version="1.0" encoding="UTF-8"?>
<!DOCTYPE valorant_state SYSTEM "valo.dtd">

<valorant_state>
    <ranks>
        <rank>
            <name>Immortal</name>
            <divisions> 1 2 3 </divisions> <!-- list -->
            <image src="...">immortal</image>
            <playerbase_percent>3%</playerbase_percent>
        </rank>
        <rank>
            <name>Radiant</name>
            <divisions> 1 </divisions> <!-- list -->
            <image src="...">radiant</image>
            <playerbase_percent>2%</playerbase_percent>
        </rank>
    </ranks>
    <teams>
        <team id="team-1">
            <name>Team 1</name>
            <players>
                <player id="player-1" active="yes">
                    <username gametag="1234">Player 1</username>
                    <player_rank division="1">Gold</player_rank>
                    <server avg_ping="20">EU</server>
                    <personal_info access="prohibited">
                        <fullname>Adam Sandler</fullname>
                        <age>28</age>
                        <country>Poland</country>
                    </personal_info>
                    <socials>
                        <link src="https://twitter.com/">Twitter | X</link>
                        <link src="https://instagram.com/">Instagram</link>
                        <link src="https://facebook.com/">Facebook</link>
                    </socials>
                    <favourites>
                        <weapon>
                            <name>Phantom</name>
                            <skin src="..." upgraded="yes">Prime</skin>
                        </weapon>
                        <agent>Jett</agent>
                        <mouse mousepad="yes" type="ambidextrous" dpi="1800">Logitech G Pro</mouse>
                        <keyboard type="mechanical">Logitech G Pro</keyboard>
                        <monitor model="XL2546">
                            <name>BenQ Zowie</name>
                            <size>27"</size>
                            <panel sync_tech="G-Sync">IPS</panel>
                            <resolution>2560 x 1440</resolution>
                            <refresh_rate>240Hz</refresh_rate>
                        </monitor>
                    </favourites>
                </player>
            </players>
        </team>
    </teams>
    <tournaments>
        <tournament>
            <name>Valorant Masters</name>
            <location>Reykjavik, Iceland</location>
            <date>May 24-30, 2021</date>
            <prize_pool currency="$">600,000</prize_pool>
            <teams>
                <team id="team_1">
                    <name>Team 1</name>
                </team>
                <team id="team_2">
                    <name>Team 2</name>
                </team>
            </teams>
        </tournament>
    </tournaments>
</valorant_state>